name,state,Full Address,lat,lng,phone,email,providesPrep,providesPep,freeSTIscreening
KD Kampung Surau,Perlis,"KD Kampung Surau, Kampung Surau, Utan Aji, 01000 Kangar, Perlis, 01000, Kangar, Perlis",,,04-9774489,,FALSE,FALSE,TRUE
KD Kepala Batas,Perlis,"KD Kepala Batas, Jalan Kuala Sanglang, Kuala Sanglang, 02800 Kangar, Perlis, 02800, Kangar, Perlis",,,04-9809771,,FALSE,FALSE,TRUE
KD Long Boh,Perlis,"KD Long Boh, Long Boh, Simpang Empat, 02700 Kangar, Perlis, 02700, Kangar, Perlis",,,04-9809836,,FALSE,FALSE,TRUE
KD Mata Ayer,Perlis,"KD Mata Ayer, KM 3, Jalan Mata Ayer, Mata Ayer, 02500 Kangar, Perlis, 02500, Kangar, Perlis",,,04-9381799,,FALSE,FALSE,TRUE
KD Padang Keria,Perlis,"KD Padang Keria, Bt. 1, Kg Padang Keria, Kuala Sanglang, 02800 Kangar, Perlis, 02800, Kangar, Perlis",,,04-9806235,,FALSE,FALSE,TRUE
KD Padang Malau,Perlis,"KD Padang Malau, KM 13, Jalan Kaki Bukit, Beseri, 02200 Kangar, Perlis, 02200, Kangar, Perlis",,,04-9383439,,FALSE,FALSE,TRUE
KD Padang Melangit,Perlis,"KD Padang Melangit, KM 9, Jalan Abi, 02400 Kangar, Perlis, 02400, Kangar, Perlis",,,04-9383825,,FALSE,FALSE,TRUE
KD Padang Pauh,Perlis,"KD Padang Pauh, KM 6, Jalan Kaki Bukit, 01000 Kangar, Perlis, 01000, Kangar, Perlis",,,04-9381815,,FALSE,FALSE,TRUE
KD Padang Siding,Perlis,"KD Padang Siding, Jalan Masjid Padang Siding, Mata Ayer, 02500 Kangar, Perlis, 02500, Kangar, Perlis",,,04-9864957,,FALSE,FALSE,TRUE
KD Panggas,Perlis,"KD Panggas, Jalan Tepi Sekolah Panggas, Chuping, 025000 Kangar, Perlis, 02500, Kangar, Perlis",,,04-9381930,,FALSE,FALSE,TRUE
KD Santan,Perlis,"KD Santan, KM 2, Jalan Santan, 01000 Kangar, Perlis, 01000, Kangar, Perlis",,,04-9774351,,FALSE,FALSE,TRUE
KD Seberang Ramai,Perlis,"KD Seberang Ramai, Jalan Kg Seberang Ramai, Kuala Perlis, 02000 Kangar, Perlis, 02000, Kangar, Perlis",,,04-9853487,,FALSE,FALSE,TRUE
KD Serdang,Perlis,"KD Serdang, Simpang Empat, 02700 Kangar, Perlis , 02700, Kangar, Perlis",,,04-9809720,,FALSE,FALSE,TRUE
KD Sungai Baru,Perlis,"KD Sungai Baru, Bt. 1, Jalan Sungai Baru, Simpang Empat, 02700 Kangar, Perlis, 02700, Kangar, Perlis",,,04-9809699,,FALSE,FALSE,TRUE
KD Sungai Padang,Perlis,"KD Sungai Padang, Jalan Sungai Padang, Simpang Empat, 02700 Kangar, Perlis, 02700, Kangar, Perlis",,,04-9774273,,FALSE,FALSE,TRUE
KD Tambun Tulang,Perlis,"KD Tambun Tulang, Jalan Tambun Tulang, Arau, 02600 Kangar, Perlis, 02600, Kangar, Perlis",,,04-9864768,,FALSE,FALSE,TRUE
KD Titi Tinggi,Perlis,"KD Titi Tinggi, Kampung Ulu Padang Besar (U), Padang Besar, 02100 Kangar, Perlis, 02100, Kangar, Perlis",,,04-9457600,,FALSE,FALSE,TRUE
KD Titi Tok Bandar,Perlis,"KD Titi Tok Bandar, Jalan Sekolah Titi Tok Bandar, Seriab, 01000 Kangar, Perlis, 01000, Kangar, Perlis",,,04-9477366,,FALSE,FALSE,TRUE
KK Arau,Perlis,"KK Arau,  Arau, 02600 Kangar,  Perlis, 02600, Kangar, Perlis",,,04-9861169  ,,FALSE,FALSE,TRUE
KK Beseri,Perlis,"KK Beseri, KM 10,Jalan Kaki Bukit, Beseri, 02400 Kangar, Perlis , 02400, Kangar, Perlis",,,04-9381355,,FALSE,FALSE,TRUE
KK Felda Chuping,Perlis,"KM 20, Felda Chuping, Mata Ayer",,,04-9774201,,FALSE,FALSE,TRUE
KK Jejawi,Perlis,"KK Jejawi, Lot 8, Jalan Jejawi Sematang, Kawasan Perindustrian Jejawi, Arau, 02600 Kangar, Perlis , 02600, Kangar, Perlis",,,04-9768672,,FALSE,FALSE,TRUE
KK Kaki Bukit,Perlis,"KK Kaki Bukit,  Kaki Bukit, 02200 Kangar, Perlis , 02200, Kangar, Perlis",,,04-9456237,,FALSE,FALSE,TRUE
KK Kampung Gial,Perlis,"KK Kampung Gial, Jalan Gial, Mata Ayer, 02500 Kangar, Perlis , 02500, Kangar, Perlis",,,04-9861177,,FALSE,FALSE,TRUE
KK Kangar,Perlis,"KK Kangar, Jalan Kolam, 01000 Kangar, Perlis , 01000, Kangar, Perlis",,,04-9778333,,FALSE,FALSE,TRUE
KK Kuala Perlis,Perlis,"KK Kuala Perlis, Bt.7, Jalan Kuala Perlis, 02000 Kangar, Perlis, 02000, Kangar, Perlis",,,04-9854259,,FALSE,FALSE,TRUE
KK Kuala Sanglang,Perlis,"KK Kuala Sanglang,  Kuala Sanglang, 02800 Kangar, Perlis, 02800, Kangar, Perlis",,,04-7940216,,FALSE,FALSE,TRUE
KK Pauh,Perlis,"Klinik Kesihatan Pauh, Pekan Pauh, 02600 Arau, Perlis",,,04-986 4726,,FALSE,FALSE,TRUE
KK Simpang Empat,Perlis,"KK Simpang Empat, Simpang Empat, 02700 Kangar, Perlis , 02700, Kangar, Perlis",,,04-9807214,,FALSE,FALSE,TRUE
KK UTC Perlis,Perlis,"KK UTC Perlis, No.1, Aras G, Blok A, Pusat Transformasi Bandar, (UTC) Perlis, Mukim Sena, 01000 Kangar, Perlis , 01000, Kangar, Perlis",,,04-9708333,,FALSE,FALSE,TRUE
KD Ansip,Sabah,"KD Ansip, Jalan Ansip-Dalit, Kampung Ansip Laut, Keningau, 89007, Keningau, Sabah",,,087-332334,,FALSE,FALSE,TRUE
KD Babagon,Sabah,"KD Babagon, Kampung Babagon, Jalan Moyog Tambunan, Babagon, Penampang, 89500, Penampang, Sabah",,,088-722054,,FALSE,FALSE,TRUE
KD Baginda,Sabah,"KD Baginda, Kampung Baginda Keningau, 89007, Keningau, Sabah",,,087-391896,,FALSE,FALSE,TRUE
KD Bahagia,Sabah,"KD Bahagia, Kg Bahagia, Nabawan, 89957, Nabawan, Sabah",,,087-366220,,FALSE,FALSE,TRUE
KD Bait,Sabah,"KD Bait, Kampung Bait, 91308, Semporna, Sabah",,,-,,FALSE,FALSE,TRUE
KD Balung Cocos,Sabah,"KD Balung Cocos, Jalan Tawau, Semporna Kg Balung Cocos, 91000, Tawau, Sabah",,,089-757535,,FALSE,FALSE,TRUE
KD Bangau,Sabah,"KD Bangau, Kg Bangau , 89059, Kudat, Sabah",,,088-641002,,FALSE,FALSE,TRUE
KD Bangkalalak,Sabah,"KD Bangkalalak, Jalan Gadung, Beaufort , 89807, Beaufort, Sabah",,,087-212096,,FALSE,FALSE,TRUE
KD Bantayan,Sabah,"KD Bantayan, Kampung Bantayan, 89208 Tuaran, 89208, Tuaran, Sabah",,,088-788224,,FALSE,FALSE,TRUE
KD Banting,Sabah,"KD Banting, Jalan Samur, Kampung Banting, 89857, Sipitang, Sabah",,,087-811506,,FALSE,FALSE,TRUE
KD Baru Jumpa,Sabah,"KD Baru Jumpa, Kampung Baru Jumpa, Jalan Kemabong, Tenom, 89907, Tenom, Sabah",,,087-734577,,FALSE,FALSE,TRUE
KD Batu 7,Sabah,"KD Batu 7, Batu 7, Jalan Labuk, 90500, Sandakan, Sabah",,,089-672902,,FALSE,FALSE,TRUE
KD Batu-Batu,Sabah,"KD Batu-Batu, Kampung Batu-Batu, Jalan Saga, Tenom, 89907, Tenom, Sabah",,,087-739001,,FALSE,FALSE,TRUE
KD Bawing,Sabah,"KD Bawing, Kg Bawing, Pitas, 89059, Pitas, Sabah",,,088-611376,,FALSE,FALSE,TRUE
KD Benoni,Sabah,"KD Benoni, Kampung Benoni, 89608 Papar , 89608, Papar, Sabah",,,088-913167,,FALSE,FALSE,TRUE
KD Berhala Darat,Sabah,"KD Berhala Darat, Kampung Berhala Barat, 90009, Sandakan, Sabah",,,089-212780,,FALSE,FALSE,TRUE
KD Biah,Sabah,"KD Biah, Jalan Ansip-Dalit, Kampung Ansip, 89007, Keningau, Sabah",,,087-336799,,FALSE,FALSE,TRUE
KD Biau,Sabah,"KD Biau, Kampung Biau, 89608 Papar, 89608, Papar, Sabah",,,088-911102,,FALSE,FALSE,TRUE
KD Binsuluk,Sabah,"KD Binsuluk, Kampung Binsuluk, Jalan Baru Ke Kuala Penyu, 89807, Beaufort, Sabah",,,087-214101,,FALSE,FALSE,TRUE
KD Bolong,Sabah,"KD Bolong, Kampung Bolong, Jalan Tuaran, 89208, Tuaran, Sabah",,,088-792010,,FALSE,FALSE,TRUE
KD Bongkud,Sabah,"KD Bongkud, Peti Surat 441, Kg Bongkud, 89300 Ranau, 89308, Ranau, Sabah",,,088-875827,,FALSE,FALSE,TRUE
KD Botition,Sabah,"KD Botition, Kampung Botition, Beluran, 90107, Beluran, Sabah",,,089-511122 ,,FALSE,FALSE,TRUE
KD Bubul,Sabah,"KD Bubul, Kampung Bubul, 91308, Semporna, Sabah",,,089-781811,,FALSE,FALSE,TRUE
KD Bukau,Sabah,"KD Bukau, Jalan Sipitang, Kampung Bakau, 89807, Beaufort, Sabah",,,087-224690,,FALSE,FALSE,TRUE
KD Bulu Silau,Sabah,"KD Bulu Silau, Bt 4, Jalan Sook-Nabawan, Kampung Bilah, Keningau, 89007, Keningau, Sabah",,,087-336823,,FALSE,FALSE,TRUE
KD Bundu,Sabah,"KD Bundu, Batu 4, Kg Bundu, Kuala Penyu, 89747, Kuala Penyu, Sabah",,,087-885078,,FALSE,FALSE,TRUE
KD Bundung,Sabah,"KD Bundung, Kampung Bundung, 89208 Tuaran, 89200, Tuaran, Sabah",,,088-897100,,FALSE,FALSE,TRUE
KD Bunga Raya,Sabah,"KD Bunga Raya, Kampung Tonobon Baru, Off Kg Bunga Raya, Keningau, 89007, Keningau, Sabah",,,087-304006,,FALSE,FALSE,TRUE
KD Cenderawasih,Sabah,"KD Cenderawasih, Felda Sahabat 7, Lahad Datu, 61167, Lahad Datu, Sabah",,,089-812854,,FALSE,FALSE,TRUE
KD Dalit,Sabah,"KD Dalit, Kampung Dalit Station, SK Dalit, Keningau, 89007, Keningau, Sabah",,,087-723007,,FALSE,FALSE,TRUE
KD Dualog,Sabah,"KD Dualog, Kg Dualog, 89507, Kudat, Sabah",,,088-896870,,FALSE,FALSE,TRUE
KD Dudar,Sabah,"KD Dudar, Kg Dudar, Jalan Kudat, 89158 Kota Belud, 89158, Kota Belud, Sabah",,,088-963010,,FALSE,FALSE,TRUE
KD Egang-Egang,Sabah,"KD Egang-Egang, Kampung Egang-Egang, 91308, Semporna, Sabah",,,089-786632,,FALSE,FALSE,TRUE
KD Fajar Harapan,Sabah,"KD Fajar Harapan, Felda Sahabat 22, Lahad Datu, 61167, Lahad Datu, Sabah",,,089-882178 (,,FALSE,FALSE,TRUE
KD Gadong,Sabah,"KD Gadong, Jalan Gadong, 89807, Beaufort, Sabah",,,087-224677,,FALSE,FALSE,TRUE
KD Gadong Kimanis,Sabah,"KD Gadong Kimanis, Jalan Kimanis, Papar , 89608, Papar, Sabah",,,088-916399,,FALSE,FALSE,TRUE
KD Gana,Sabah,"KD Gana, Kampung Gana, Kota Marudu, 89108, Kota Marudu, Sabah",,,088-661884 ,,FALSE,FALSE,TRUE
KD Garas,Sabah,"KD Garas, Jalan Tambunan-Ranau, Simpang Kiri, Jalan Kg Pahu, Tambunan, 89650, Tambunan, Sabah",,,088-899607,,FALSE,FALSE,TRUE
KD Gaya Ratau,Sabah,"KD Gaya Ratau, Jalan Tamparuli, Kampung Gaya Ratau, 89208, Tuaran, Sabah",,,088-783151,,FALSE,FALSE,TRUE
KD Goshen,Sabah,"KD Goshen, Kampung Goshen, Jalan Goshen, Kota Marudu, 89108, Kota Marudu, Sabah",,,088-661304,,FALSE,FALSE,TRUE
KD Gum-Gum,Sabah,"KD Gum-Gum, Kampung Gum-Gum, 90500, Sandakan, Sabah",,,089-535385,,FALSE,FALSE,TRUE
KD Hampalan,Sabah,"KD Hampalan, Kampung Hampalan, 91308, Semporna, Sabah",,,089-786461,,FALSE,FALSE,TRUE
KD Hamparan Badai,Sabah,"KD Hamparan Badai, Felda Sahabat 27, Lahat Datu, 61167, Lahad Datu, Sabah",,,089-882178 (,,FALSE,FALSE,TRUE
KD Kabajang,Sabah,"KD Kabajang, Jalan Beaufort Gadang, Kg Kabajang, 89807, Beaufort, Sabah",,,087-208334,,FALSE,FALSE,TRUE
KD Kabongan,Sabah,"KD Kabongan, Kampung Kabongan, 91308, Semporna, Sabah",,,089-786608,,FALSE,FALSE,TRUE
KD Kanibongan,Sabah,"KD Kanibongan, Kg Kanibongan, Pitas, 89507, Pitas, Sabah",,,088-886202,,FALSE,FALSE,TRUE
KD Kaniongan,Sabah,"KD Kaniongan, Pulau Keniongan, Beluran, 90108, Beluran, Sabah",,,089-239005,,FALSE,FALSE,TRUE
KD Karamatoi,Sabah,"KD Karamatoi, Skim Penempatan SAFODA, Karamatoi, Sook, Keningau, 89007, Keningau, Sabah",,,087-723002,,FALSE,FALSE,TRUE
KD Karambunai,Sabah,"KD Karambunai, Jalan Sepangar, Kota Kinabalu, 88450, Kota Kinabalu, Sabah",,,088-411045,,FALSE,FALSE,TRUE
KD Karamuak,Sabah,"KD Karamuak, Kampung Karamuak Dalam, Tongod, 90200, Tongod, Sabah",,,-,,FALSE,FALSE,TRUE
KD Karamunting,Sabah,"KD Karamunting, Kampung Karamunting, 90500, Sandakan, Sabah",,,089-617042,,FALSE,FALSE,TRUE
KD Kauluan,Sabah,"KD Kauluan, Jalan Tamparuli, Kampung Kauluan, 89208, Tuaran, Sabah",,,088-783519,,FALSE,FALSE,TRUE
KD Kaung Ulu,Sabah,"KD Kaung Ulu, Kg Kaung, Jalan Ranau 89158, 89158, Kota Belud, Sabah",,,088-883047,,FALSE,FALSE,TRUE
KD Kawang,Sabah,"KD Kawang, Kampung Kawang, Papar , 89608, Papar, Sabah",,,-,,FALSE,FALSE,TRUE
KD Kayangat,Sabah,"KD Kayangat, Kampung Rani Tenghilan, 89208 Tuaran, 89208, Tuaran, Sabah",,,088-8886012 ,,FALSE,FALSE,TRUE
KD Kebatang Baru,Sabah,"KD Kebatang Baru, Jalan Sook-Tulid, Kg Kebatang Baru, Sook, Keningau, 89007, Keningau, Sabah",,,087-306008,,FALSE,FALSE,TRUE
KD Kebayau,Sabah,"KD Kebayau, Jalan Bypass Ranau, 89158 Kota Belud, 89158, Kota Belud, Sabah",,,088-883002,,FALSE,FALSE,TRUE
KD Kelatuan,Sabah,"KD Kelatuan, Kampung Kelatuan, Papar, 89607, Papar, Sabah",,,088-916400,,FALSE,FALSE,TRUE
KD Kelawat,Sabah,"KD Kelawat, Kg.Kelawat, Jalan Kota Kinabalu, 89150 Kota Belud, 89208, Tuaran, Sabah",,,-,,FALSE,FALSE,TRUE
"KD Kelawat, Tuaran",Sabah,"KD Kelawat, Tuaran, Kg.Kelawat, Jalan Kota Kinabalu, 89150 Kota Belud, 89158, Kota Belud, Sabah",,,-,,FALSE,FALSE,TRUE
KD Kembara Sakti,Sabah,"KD Kembara Sakti, Felda Sahabat 43, Lahad Datu, 61167, Lahad Datu, Sabah",,,089-882178 (,,FALSE,FALSE,TRUE
KD Kerokot,Sabah,"KD Kerokot, Jalan Tambunan-Ranau, Simpang Kanan, Jln SK Kerokot, Tambunan, 89650, Tambunan, Sabah",,,088-899608,,FALSE,FALSE,TRUE
KD Kiabau,Sabah,"KD Kiabau, Jalan Telupid, Kampung Kiabau, 90108, Telupid, Sabah",,,-,,FALSE,FALSE,TRUE
KD Kiambor,Sabah,"KD Kiambor, Kampung Kiambor, Kuala Penyu, 89747, Kuala Penyu, Sabah",,,087-885071,,FALSE,FALSE,TRUE
KD Kiau,Sabah,"KD Kiau, Kg Kiau Taburi, P/S 485, 89308 Ranau, 89158, Kota Belud, Sabah",,,-,,FALSE,FALSE,TRUE
KD Kinarasan,Sabah,"KD Kinarasan, Jalan Tambunan, Kinarasan, Ranau, 89200, Ranau, Sabah",,,088-897200,,FALSE,FALSE,TRUE
KD Kionsom,Sabah,"KD Kionsom, Kampung Kionsom, Kota Kinabalu, 89350, Kota Kinabalu, Sabah",,,088-430108,,FALSE,FALSE,TRUE
KD Klias Scheme,Sabah,"KD Klias Scheme, Jalan Beaufort Menumbuk, Kg Rancangan, 89807, Beaufort, Sabah",,,087-223088,,FALSE,FALSE,TRUE
KD Kokol,Sabah,"KD Kokol, Kampung Kokol, Kota Kinabalu, 89350, Kota Kinabalu, Sabah",,,088-302554,,FALSE,FALSE,TRUE
KD Kolapis,Sabah,"KD Kolapis, Kampung Kolapis, 90108 Beluran, 90108, Beluran, Sabah",,,089-512985,,FALSE,FALSE,TRUE
KD Kuala Abai,Sabah,"KD Kuala Abai, Kg. Kuala Abai, Jalan Port Usukan, 89158 Kota Belud, 89158, Kota Belud, Sabah",,,088-961006,,FALSE,FALSE,TRUE
KD Kuala Merotai,Sabah,"KD Kuala Merotai, Kampung Iban, 91800 Tawau , 91000, Tawau, Sabah",,,089-796117,,FALSE,FALSE,TRUE
KD Kuala Taburi,Sabah,"KD Kuala Taburi, Jalan Ulu Tungku, Lahad Datu , 61167, Lahad Datu, Sabah",,,089-882178 (,,FALSE,FALSE,TRUE
KD Lagud Sebarang,Sabah,"KD Lagud Sebarang, Jalan Taman Pertanian, Lagud Sebarang, Tenom, 89907, Tenom, Sabah",,,087-736355,,FALSE,FALSE,TRUE
KD Lajong,Sabah,"KD Lajong, Kg Lanjong, 89059, Kudat, Sabah",,,088-671019,,FALSE,FALSE,TRUE
KD Lamag,Sabah,"KD Lamag, Kg Silam Jalan Silam, LahaD Datu, 61167, Lahad Datu, Sabah",,,089-882178 (,,FALSE,FALSE,TRUE
KD Lasau Takulung,Sabah,"KD Lasau Takulung, Kg Lasau Takulung, Jalan Kompleke Sukan, 89150 Kota Belud, 89158, Kota Belud, Sabah",,,088-959021,,FALSE,FALSE,TRUE
KD Limbanak,Sabah,"KD Limbanak, Kampung Limbanak, Jalan Papar Lama, Limbanak Penampang, 89500, Penampang, Sabah",,,088-710845,,FALSE,FALSE,TRUE
KD Lingkungan,Sabah,"KD Lingkungan, Jalan Sipitang, Kg Lingkungan, 89807 Beaufort, 89807, Beaufort, Sabah",,,087-871296,,FALSE,FALSE,TRUE
KD Lormalong,Sabah,"KD Lormalong, Kampung Lormalong, 91207, Kunak, Sabah",,,089-821741,,FALSE,FALSE,TRUE
KD Lotong,Sabah,"KD Lotong, Jalan Tambunan-Keningau, Simpang Kanan, SK Lotong Tambunan, 89650, Tambunan, Sabah",,,-,,FALSE,FALSE,TRUE
KD Lubak,Sabah,"KD Lubak, Jalan Padas Damit, Kg Lubak, 89807, 89807, Beaufort, Sabah",,,087-223578,,FALSE,FALSE,TRUE
KD Lumondou,Sabah,"KD Lumondou, Jalan Tambunan-Ranau, Jln Kg Tangaban, Tambunan, 89650, Tambunan, Sabah",,,087-773464,,FALSE,FALSE,TRUE
KD Madai,Sabah,"KD Madai, Kampung Madai, 91207, Kunak, Sabah",,,089-851733 (,,FALSE,FALSE,TRUE
KD Malalin,Sabah,"KD Malalin, Kampung Malalin, Beluran, 90107, Beluran, Sabah",,,089-511122 ,,FALSE,FALSE,TRUE
KD Malaman,Sabah,"KD Malaman, Jalan Sipitang Tenom, Kampung Malaman, 89857, Sipitang, Sabah",,,087-812897,,FALSE,FALSE,TRUE
KD Malinsau,Sabah,"KD Malinsau, Kampung Malinsau, 89307 Ranau, 89308, Ranau, Sabah",,,088-959025,,FALSE,FALSE,TRUE
KD Mandalom,Sabah,"KD Mandalom, Kampung Mandalum, Jalan Saga, Tenom, 89907, Tenom, Sabah",,,087-739003,,FALSE,FALSE,TRUE
KD Mandurian,Sabah,"KD Mandurian, Kg Mandurian, Pitas, 89059, Pitas, Sabah",,,088-896323,,FALSE,FALSE,TRUE
KD Mapan-Mapan,Sabah,"KD Mapan-Mapan, Kg Mapan, Pitas, 89059, Pitas, Sabah",,,088-611376,,FALSE,FALSE,TRUE
KD Marak Parak,Sabah,"KD Marak Parak, Kampung Marak Parak, 89108 Kota Kinabalu, 89108, Kota Marudu, Sabah",,,088-959022,,FALSE,FALSE,TRUE
KD Marudu,Sabah,"KD Marudu, Pekan Lama, Kota Marudu, 89108, Kota Marudu, Sabah",,,088-661715,,FALSE,FALSE,TRUE
KD Matupang,Sabah,"KD Matupang, Jalan Sandakan, Kg Matupang, Ranau, 89308, Ranau, Sabah",,,-,,FALSE,FALSE,TRUE
KD Mengkabau,Sabah,"KD Mengkabau, Kg Mangkubau, Pitas, 89059, Pitas, Sabah",,,088-897503,,FALSE,FALSE,TRUE
KD Mengkabong,Sabah,"KD Mengkabong, Jalan Mengkabong, Tuaran , 89208, Tuaran, Sabah",,,088-792324,,FALSE,FALSE,TRUE
KD Merapok,Sabah,"KD Merapok, Kampung Merapok, Keningau, 89007, Keningau, Sabah",,,087-721813,,FALSE,FALSE,TRUE
KD Mesapol,Sabah,"KD Mesapol, Jalan Sipitang, Kampung Pekan Mesapol, 89857, Sipitang, Sabah",,,087-822918,,FALSE,FALSE,TRUE
KD Milau,Sabah,"KD Milau, Kg Milau, 89059, Kudat, Sabah",,,088-896519,,FALSE,FALSE,TRUE
KD Mosolog,Sabah,"KD Mosolog, Kampung Masolog, Kota Marudu, 89108, Kota Marudu, Sabah",,,088-663632,,FALSE,FALSE,TRUE
KD Moyog,Sabah,"KD Moyog, Kampung Moyog, Jalan Moyog, Tambunan, Moyog, 89500, Penampang, Sabah",,,088-727499,,FALSE,FALSE,TRUE
KD Mumiang,Sabah,"KD Mumiang, Kampung Mumiang, 90500, Sandakan, Sabah",,,-,,FALSE,FALSE,TRUE
KD Nalapak,Sabah,"KD Nalapak, Kampung Nalapak, Peti Surat 14, 89308 Ranau, 89308, Ranau, Sabah",,,088-897300,,FALSE,FALSE,TRUE
KD Nambayan,Sabah,"KD Nambayan, Jalan Tambunan-Keningau, Simpang Kiri, Jalan Kg Lubong Tambunan, 89650, Tambunan, Sabah",,,087-773541,,FALSE,FALSE,TRUE
KD Narawang,Sabah,"KD Narawang, Kampung Narawang, 89300 Ranau, 89308, Ranau, Sabah",,,088-871235,,FALSE,FALSE,TRUE
KD Nosoob,Sabah,"KD Nosoob, Kampung Nosoob, Jalan Kabusak, Penampang, 89500, Penampang, Sabah",,,088-724045,,FALSE,FALSE,TRUE
KD P.P.H. Kem Keningau,Sabah,"KD P.P.H. Kem Keningau, Jalan Apin Apin, Off Jalan Kompleks Polis Keningau, 89007, Keningau, Sabah",,,087-337334,,FALSE,FALSE,TRUE
KD Paal,Sabah,"KD Paal, Kampung Paal, Jalan Kemabong, Kemabong, Tenom, 89907, Tenom, Sabah",,,087-739015,,FALSE,FALSE,TRUE
KD Pahu,Sabah,"KD Pahu, Kampung Tomis Lamar, Tuaran , 89208, Tuaran, Sabah",,,-,,FALSE,FALSE,TRUE
KD Pamilaan,Sabah,"KD Pamilaan, Kampung Pamilaan, Jalan Tenom Keningau Pamilaan, 89907, Tenom, Sabah",,,087-739005,,FALSE,FALSE,TRUE
KD Pandasan,Sabah,"KD Pandasan, Kg Pandasan, Jalan Kudat, 89158 Kota Belud, 89158, Kota Belud, Sabah",,,-,,FALSE,FALSE,TRUE
KD Pandewan,Sabah,"KD Pandewan, Kg Pandewan, Jalan Sepulot, 89957, Nabawan, Sabah",,,87722100,,FALSE,FALSE,TRUE
KD Pantai,Sabah,"KD Pantai, Kampung Pantai, Jalan Sipitang, 89857, Sipitang, Sabah",,,087-811507,,FALSE,FALSE,TRUE
KD Payas-Payas,Sabah,"KD Payas-Payas, Kg Pantai Emas, Jalan Port Usukan, 89158 Kota Belud, 89158, Kota Belud, Sabah",,,-,,FALSE,FALSE,TRUE
KD Pengalat Besar,Sabah,"KD Pengalat Besar, Kampung Pengalat Besar, 89608 Papar, 89608, Papar, Sabah",,,088-915013,,FALSE,FALSE,TRUE
KD Pengkalan Abai,Sabah,"KD Pengkalan Abai, Kg Pengkalan Abai, Jalan Kota Kinabalu, 89150 Kota Belud, 89158, Kota Belud, Sabah",,,-,,FALSE,FALSE,TRUE
KD Penimbawan,Sabah,"KD Penimbawan, Kampung Penimbawan, Tuaran, 89209, Tuaran, Sabah",,,088-792431,,FALSE,FALSE,TRUE
KD Petagas,Sabah,"KD Petagas, Kampung Petagas, Jalan Putatan Kota Kinabalu, Petagas, 89500, Putatan, Sabah",,,088-763892,,FALSE,FALSE,TRUE
KD Pimping,Sabah,"KD Pimping, Kampung Pimping, Membakut, 89807, Beaufort, Sabah",,,087-889569,,FALSE,FALSE,TRUE
KD Pinawantai,Sabah,"KD Pinawantai, Kampung Pinawantai, 89300 Ranau, 89308, Ranau, Sabah",,,088-959026,,FALSE,FALSE,TRUE
KD Pingan-Pingan,Sabah,"KD Pingan-Pingan, Kg Pinggan-Pinggan, Pitas, 89059, Pitas, Sabah",,,088-625066,,FALSE,FALSE,TRUE
KD Pomotodon,Sabah,"KD Pomotodon, Kampung Pomotodon, Kota Kinabalu, 89530, Kota Kinabalu, Sabah",,,088-431285,,FALSE,FALSE,TRUE
KD Pukak,Sabah,"KD Pukak, Kampung Pukak, 89208 Tuaran, 89200, Tuaran, Sabah",,,088-886707,,FALSE,FALSE,TRUE
KD Pulau Sakar,Sabah,"KD Pulau Sakar, Kg Tanjung Paras, Lahad Datu, 61167, Lahad Datu, Sabah",,,089-882178 (,,FALSE,FALSE,TRUE
KD Quoin Hill,Sabah,"KD Quoin Hill, Jalan Bukit Quoin, 91000 Tawau, 91000, Tawau, Sabah",,,089-916010,,FALSE,FALSE,TRUE
KD Rampaian Laut,Sabah,"KD Rampaian Laut, Kg Nanuman, Jalan Kudat, 89150 Kota Belud, 89158, Kota Belud, Sabah",,,-,,FALSE,FALSE,TRUE
KD Rompon,Sabah,"KD Rompon, Jalan Tambunan-Keningau, Simpang Kiri, Jln Kg Rompon Tambunan, 89650, Tambunan, Sabah",,,087-777003,,FALSE,FALSE,TRUE
KD Rondugung,Sabah,"KD Rondugung, Kampung Rondugung, 89300 Ranau, 89308, Ranau, Sabah",,,088-897209,,FALSE,FALSE,TRUE
KD Rosob,Sabah,"KD Rosob, Kg Rosob, Pitas, 89059, Pitas, Sabah",,,088-611376,,FALSE,FALSE,TRUE
KD Rosok,Sabah,"KD Rosok, Kg.Rosok, Jalan Kompleks Sukan, 89150 Kota Belud, 89158, Kota Belud, Sabah",,,-,,FALSE,FALSE,TRUE
KD Salimandut,Sabah,"KD Salimandut, Kampung Salimandut, Kota Marudu, 89108, Kota Marudu, Sabah",,,088-661506,,FALSE,FALSE,TRUE
KD Samparita,Sabah,"KD Samparita, Kampung Samparita, Kota Marudu, 89108, Kota Marudu, Sabah",,,088-666103 ,,FALSE,FALSE,TRUE
KD Sapong,Sabah,"KD Sapong, Kampung Sapong, Jalan Kemabong, Sapong, Tenom, 89907, Tenom, Sabah",,,087-733816,,FALSE,FALSE,TRUE
KD Sayap,Sabah,"KD Sayap, Kg Sayap, Jalan Sorob, 89150 Kota Belud, 89158, Kota Belud, Sabah",,,088-959023,,FALSE,FALSE,TRUE
KD Segama,Sabah,"KD Segama, Batu 6, Kg Cocos, Lahad Datu, 61167, Lahad Datu, Sabah",,,089-882178 (,,FALSE,FALSE,TRUE
KD Senagang,Sabah,"KD Senagang, Jalan Tenom, Kampung  Senagang, Keningau, 89007, Keningau, Sabah",,,087-302051,,FALSE,FALSE,TRUE
KD Sepagaya,Sabah,"KD Sepagaya, Kampung Sepayaga, Jalan Sialm, Peti Surat 61167 Lahad Datu, 61167, Lahad Datu, Sabah",,,089-882178 (,,FALSE,FALSE,TRUE
KD Sibuga,Sabah,"KD Sibuga, Kampung Sibunga, 90500, Sandakan, Sabah",,,089-663770,,FALSE,FALSE,TRUE
KD Simpudu,Sabah,"KD Simpudu, Kampung Simpudu, 89608 Papar, 89608, Papar, Sabah",,,088-912134,,FALSE,FALSE,TRUE
KD Sinoko,Sabah,"KD Sinoko, Kampung Sinoko, Membakut, 89807, Beaufort, Sabah",,,-,,FALSE,FALSE,TRUE
KD Sungai Buaya,Sabah,"KD Sungai Buaya, Jalan Bugaya, Kg Sg Buaya, 91308, Semporna, Sabah",,,089-792001,,FALSE,FALSE,TRUE
KD Sungai Imam,Sabah,"KD Sungai Imam, Kampung Sungai Imam, Jalan Merotai, 91000, Tawau, Sabah",,,089-796289,,FALSE,FALSE,TRUE
KD Sungoi,Sabah,"KD Sungoi, Kampung Sungoi, Simpang Jalan Tudan Poring, Penampang, 89500, Penampang, Sabah",,,088-886734 ,,FALSE,FALSE,TRUE
KD Tagaroh,Sabah,"KD Tagaroh, Kampung Tagaroh, Kota Marudu, 89108, Kota Marudu, Sabah",,,088-663829,,FALSE,FALSE,TRUE
KD Tagasan,Sabah,"KD Tagasan, Kg Tagasan, 91308 Semporna, 91308, Semporna, Sabah",,,089-782360,,FALSE,FALSE,TRUE
KD Takuli,Sabah,"KD Takuli, Kampung Takuli, Jalan Menumbuk, 89807, Beaufort, Sabah",,,087-221172,,FALSE,FALSE,TRUE
KD Tamau,Sabah,"KD Tamau, Kg Tamau, Jalan Kudat, 89158 Kota Belud, 89158, Kota Belud, Sabah",,,-,,FALSE,FALSE,TRUE
KD Tambuluran,Sabah,"KD Tambuluran, Kg Tambuluran, 89059, Kudat, Sabah",,,088-637004,,FALSE,FALSE,TRUE
KD Tampios,Sabah,"KD Tampios, Kampung Tampios, 89300 Ranau, 89308, Ranau, Sabah",,,88778047,,FALSE,FALSE,TRUE
KD Tanjong Batu,Sabah,"KD Tanjong Batu, Kampung Tanjung Batu, Kota Marudu, 89108, Kota Marudu, Sabah",,,088-630010,,FALSE,FALSE,TRUE
KD Tanjung Aru,Sabah,"KD Tanjung Aru, Kampung Tanjung Aru , 90509, Sandakan, Sabah",,,-,,FALSE,FALSE,TRUE
KD Tanjung Batu Darat,Sabah,"KD Tanjung Batu Darat, Jalan Utara Baru, Kg Tanjung Batu Darat, 91000, Tawau, Sabah",,,089-755896,,FALSE,FALSE,TRUE
KD Tanjung Kapor,Sabah,"KD Tanjung Kapor, Jalan Bugaya, Kg Tanjung Kapur , 91308, Semporna, Sabah",,,089-786653,,FALSE,FALSE,TRUE
KD Tanjung Labian,Sabah,"KD Tanjung Labian, Kampung Tanjung Labian, 61167 Lahad Datu, 61167, Lahad Datu, Sabah",,,089-882178 (,,FALSE,FALSE,TRUE
KD Tengah Nipah,Sabah,"KD Tengah Nipah, Jalan Tungku, Peti Surat 61167 Lahat Datu, 61167, Lahad Datu, Sabah",,,089-882178 (,,FALSE,FALSE,TRUE
KD Terolobou,Sabah,"KD Terolobou, Kampung Terolobou, Jalan Bundu Tuhan 89308, 89308, Ranau, Sabah",,,088-897202,,FALSE,FALSE,TRUE
KD Tibabar,Sabah,"KD Tibabar, Kampung Tibabar, 89608 Papar, 89608, Papar, Sabah",,,088-915729,,FALSE,FALSE,TRUE
KD Timbang Batu,Sabah,"KD Timbang Batu, Kampung Timbang Batu, Kota Marudu, 89108, Kota Marudu, Sabah",,,088-664762,,FALSE,FALSE,TRUE
KD Tiulon,Sabah,"KD Tiulon, Skim Penempatan Rancangan Belia Tiulon, Sook, Keningau, 89007, Keningau, Sabah",,,087-730412,,FALSE,FALSE,TRUE
KD Toboh,Sabah,"KD Toboh, Simpang Kanan, Jalan Kg Toboh, Tambunan, 89650, Tambunan, Sabah",,,087-773544,,FALSE,FALSE,TRUE
KD Togop,Sabah,"KD Togop, Kampung Togop, 89208, Tuaran, Sabah",,,088-886105,,FALSE,FALSE,TRUE
KD Tombongan,Sabah,"KD Tombongan, Kampung Tombongan, Kota Kinabalu, 88450, Kota Kinabalu, Sabah",,,-,,FALSE,FALSE,TRUE
KD Tontolob Liwan,Sabah,"KD Tontolob Liwan, Sempadan Jalan Tambunan-Ranau, Kg Tontolob Liwan, Tambunan , 89650, Tambunan, Sabah",,,088-899608,,FALSE,FALSE,TRUE
KD Topokon,Sabah,"KD Topokon, Kampung Topokon, Tuaran, 89208, Tuaran, Sabah",,,088- 792431,,FALSE,FALSE,TRUE
KD Tronglit,Sabah,"KD Tronglit, Kampung Tronglit, 90009, Sandakan, Sabah",,,-,,FALSE,FALSE,TRUE
KD Tuarid Taud,Sabah,"KD Tuarid Taud, Jalan Kota Ayangan (Lama), Kg Tuarid Taud, Keningau, 89007, Keningau, Sabah",,,087-336916,,FALSE,FALSE,TRUE
KD Ulu Tomani,Sabah,"KD Ulu Tomani, Kampung Ulu Tomani, Ulu Tomani, Tenom, 89907, Tenom, Sabah",,,087-746001,,FALSE,FALSE,TRUE
KK Abuan,Sabah,"KK Abuan, Kampung Abuan, Beluran, 90108, Beluran, Sabah",,,-,,FALSE,FALSE,TRUE
KK Apas Balung,Sabah,"KK Apas Balung, Jalan Apas Balung, Tawau, 91000, Tawau, Sabah",,,089-926540,,FALSE,FALSE,TRUE
KK Apin-Apin,Sabah,"KK Apin-Apin, Jalan Apin-Apin-Kota Kinabalu, Kg Kikiran, Apin-Apin, Keningau, 89007, Keningau, Sabah",,,087-337371,,FALSE,FALSE,TRUE
KK Batu 10,Sabah,"KK Batu 10, Batu 10, Sandakan, 90009, Sandakan, Sabah",,,-,,FALSE,FALSE,TRUE
KK Batu Putih,Sabah,"KK Batu Putih, Kampung Batu Putih, Jalan Kinabatangan Lahad Datu, Batu Putih, Kinabatangan, 89108, Kinabatangan, Sabah",,,088-667320 ,,FALSE,FALSE,TRUE
KK Bingkor,Sabah,"KK Bingkor, Jalan Bunsit, Pekan Bingkor, Keningau, 89007, Keningau, Sabah",,,087-391158,,FALSE,FALSE,TRUE
KK Bongawan,Sabah,"KK Bongawan, Jln. Besar Pekan Bongawan, 89700 Bongawan, Papar, 89600, Papar, Sabah",,,088-722017 (,,FALSE,FALSE,TRUE
KK Bongkol,Sabah,"KK Bongkol, Kampung Bongkol, Bongkol, 89108, Pitas, Sabah",,,088-877353,,FALSE,FALSE,TRUE
KK Bukit Belacon,Sabah,"KK Bukit Belacon, Bukit Belacon, Segama, Lahad Datu, 91120, Lahad Datu, Sabah",,,089-816001,,FALSE,FALSE,TRUE
KK Bukit Garam,Sabah,"KK Bukit Garam, Bukit Garam, Kinabatangan, 90200, Kinabatangan, Sabah",,,019-8005359 ,,FALSE,FALSE,TRUE
KK Bundu Tuhan,Sabah,"KK Bundu Tuhan, Jalan Keranau, Kg Bundu Tuhan, 89308 Ranau, 89308, Ranau, Sabah",,,088-889722,,FALSE,FALSE,TRUE
KK Dandun,Sabah,"KK Dandun, Kampung Dandun, Dandun, 89108, Pitas, Sabah",,,088-889505,,FALSE,FALSE,TRUE
